code,product_name_en,quantity_gms,packaging,brands,ingredients_text_en,energy-kcal_value,fat_value_gms,saturated-fat_value_gms,carbohydrates_value_gms,sugars_value_gms,fiber_value_gms,proteins_value_gms,salt_value_gms,sodium_value_mg,trans-fat_value_gms,cholesterol_value_mg,added-sugars_value_gms,off:nova_groups,off:nutriscore_grade
8901725134723,Bounce Choco Twist,82,Plastic,Sunfeast,"WHEAT FLOUR, SUGAR, REFINED PALM OIL, INVERT SYRUP, RAISING AGENTS [INS 503(ii), INS 500(ii), INS 450(i)], COCOA SOLIDS (0.5%), EDIBLE COMMON SALT, EMULSIFIERS (INS 322(i), INS 435), MILK SOLIDS AND STARCH. CONTAINS PERMITTED NATURAL COLOUR(S) (INS 150c, INS 150d) AND SYNTHETIC FOOD COLOUR(S) (INS 122 AND ADDED FLAVOUR(S) (NATURE IDENTICAL FLAVOURING SUBSTANCES CHOCOLATE, NUT AND ARTIFICIAL FLAVOURING SUBSTANCES CHOCOLATE, VANILLA MILK)",467,15.9,7.8,74.3,36.9,,6.8,,,0.1,,,4,unknown
8901233030272,Perk,14.3,Plastic,Cadbury,"COATED WAFER LAYERS Ingredients- Sugar, Hydrogenated vegetable fat, Refined wheat flour, Milk solids, Starch, Cocoa solids (5%), Palmolein oil, Emulsifiers (442, 322, 476), Edible salt, Yeast, Raising agent (500(ii)), Improver (Enzyme) CONTAINS ADDED FLAVOUR [NATURAL, NATURE IDENTICAL AND ARTIFICIAL (CARAMEL AND ETHYL VANILLIN) FLAVOURING SUBSTANCES]",517,25.8,23.4,67.6,45.9,1.8,3.6,0.233,93.47,0.2,,,4,e
8901063004122,GoodDay Choco Chip,100,Plastic,Britannia,"REFINED WHEAT FLOUR, SUGAR, EDIBLE VEGETABLE OIL(PALM), CHOCOLATE CHIPS (11%) [SUGAR, COCOA SOLIDS, COCOA BUTTER, DEXTROSE, EMULSIFIER (322) AND ADDED NATURAL FLAVOURING SUBSTANCES (VANILLA)] CHOCOCHIPS (10%) [SUGAR EDIBLE HYDROGENATED VEGETABLE OIL (PALM), COCOA SOLIDS, DEXTROSE, EMULSIFIER(322) AND ADDED NATURAL FLAVOURING SUBSTANCES (VANILLA)], INVERT SYRUP RAISING AGENTS [503(ii),500(ii),450(i)], COCOA SOLIDS, EDIBLE COMMON SALT AND EMULSIFIERS (322,472e) CONTAINS PERMITTED NATURAL FOOD COLOUR (150d) AND ADDED FLAVOURS [NATURE IDENTICAL AND ARTIFICIAL FLAVOURING SUBSTANCES (CHOCOLATE & VANILLA)]",493,21,7.5,71,30,,5,,,0,0,,4,unknown
8901063162242,Britannia Marie Gold,1000,Plastic,Britannia,"REFINED WHEAT FLOUR (MAIDA) (73%), SUGAR, REFINED PALM OIL, INVERT SUGAR SYRUP, MILK SOLIDS, RAISING AGENTS [503 (ii) & 500 (ii)], IODIZED SALT, EMULSIFIER (472e), CALCIUM SALT, DOUGH CONDITIONER (223), VITAMINS*, FERROUS SALT AND POTASSIUM IODATE. CONTAINS PERMITTED NATURAL COLOUR (150d) AND ADDED FLAVOURSINATURE IDENTICAL & ARTIFICIAL (MILK & VANILLA) FLAVOURING SUBSTANCES]",,,,,,,,,,,,,4,unknown
8906074821461,Bitterly Osmania Biscuits,300,,Karachi Bakery,"Refined wheat flour (Maida), Edible vegetable oil (Refined Rice bran oil, Palmolein oil, sesame/ til oil), Sugar, Table Butter, Milk Solids (SMP), iodised Salt.",546,32,16,58,8,6,7,1.704,681.73,,,,3,e
8901233027555,Cadbury Choco Creme Oreo,300,,Cadbury,"SANDWICH BISCUIT INGREDIENTS: Refined Wheat Flour (Maida), Sugar, Edible Vegetable Fat, Palmolein, Cocoa Solids (3%*), Invert Sugar, Leavening Agents (500(ii), 503(ii)), Edible Salt, Emulsifier (322). CONTAINS ADDED FLAVOUR (NATURE IDENTICAL FLAVOURING SUBSTANCES).,480,19.7,9.8,70.3,37.8,,5.5,1.264,505.96,0.2,,,4,e
3948719100369,Hide And Seek,33,,Parle,"Wheat Floor, Chocolate, Sugar, Palm Oil, Invert Sugar Syrup, Iodised Salt,",479,0.4,,103,,,5.9,,,,,,4,unknown
8901928014006,Marie biscuits,300,,Bisk Farm,"INGREDIENTS: WHEAT FLOUR (65%), SUGAR, EDIBLE VEGETABLE OIL, INVERT SYRUP, LIQUIDLUCOSE, CONDENSED MILK, SALT, MILK SOLIDS, LEAVENING AGENTS [500(), 503/00/EMULSIFERSA1,481),DOUGH CONDITIONER (223), ENZYMES AND ANTIOXIDANT (319) roATAINS ADDEDhaTIFICIAL FLAVOURING SUBSTANCES (MILK, BUTTER, VANILLA) CNUMBE RS IN BRACKETS ARE AS PER INTERNATIONAL NUMBERING SYSTEM) TSPASCUIT CONTAINS WHEAT&MILK HYPERSENSITIVE INGREDIENTS",413,13.01,6.2,67.25,18.73,,,,,0,0,,4,unknown
8906062600375,e-Millet cookies,150,,Moon Foods,"Finger Millet Flour, Atta, Cane Sugar, Vegetable Oils & Salt",505.6,23.5,,63.5,,0.37,5.3,,,,,,3,unknown
8904150502242,Mini Cookie Cake,66,,Pillsbury,"wheat flour, sugar, glucose syrup, edible vegetable oil (sunflower, palm), dark compound choco chips 7.7%, emulsifer (INS 491, INS322), DARK compound Choco drizzle 5.2%, cocoa solids, fructose,dextrose, humecrant, milk solids 2%, water, calcium carbonate, modified starch (INS1442), baking powder, corn starch, iodized salt, INS500, INS341, INS415, INS410, Vitamin D",420,15.3,7.4,67,,,4.2,1.089,435.86,,,,4,unknown
