code,product_name,brands,categories,nova_group,nutriscore_grade,url
8901260000000,Amul Belgian chocolate,Amul,Chocolate bars,4,unknown,http://world-en.openfoodfacts.org/product/8901262071017/amul-belgian-chocolate
8901260000000,Amul Butterscotch Bliss,Amul,"Desserts,Frozen foods,Frozen desserts,Ice creams and sorbets,Ice creams",4,c,http://world-en.openfoodfacts.org/product/8901262170093/amul-butterscotch-bliss
8901260000000,Amul Butterscotch Gold,Amul,ice creams,4,unknown,http://world-en.openfoodfacts.org/product/8901262174480/amul-butterscotch-gold
2000000000000,Amul Cheese Slices,Amul,"Dairies, Fermented foods, Fermented milk products, Cheeses, Processed cheese, Processed cheese in slices",4,e,http://world-en.openfoodfacts.org/product/2000000136641/amul-cheese-slices
8901260000000,Amul Chocobar Probiotic,Amul,"Desserts,Frozen foods,Frozen desserts,Ice creams and sorbets,Ice creams,Ice cream bars",4,c,http://world-en.openfoodfacts.org/product/8901262176224/amul-chocobar-probiotic
8901260000000,Amul Chocolate Brownie,Amul,"Chocolate icecream, Icecream",4,d,http://world-en.openfoodfacts.org/product/8901262172448/amul-chocolate-brownie
8901260000000,Amul Frostik Gold,Amul,"Desserts,Frozen foods,Frozen desserts,Ice creams and sorbets,Ice creams,Ice cream bars,Ice cream bars coated with chocolate",4,unknown,http://world-en.openfoodfacts.org/product/8901262300520/amul-frostik-gold
8901260000000,Amul Fruit 'N&quot; Nut,Amul,"Snacks,Sweet snacks,Cocoa and its products,Chocolates,Dark chocolates",4,d,http://world-en.openfoodfacts.org/product/8901262070058/amul-fruit-n-nut
8901260000000,Amul Kool Premium Kesar Flavour,Amul,"Beverages and beverages preparations,Beverages,Dairies,Dairy drinks",4,e,http://world-en.openfoodfacts.org/product/8901262152341/amul-kool-premium-kesar-flavour
8901260000000,Amul Lassi,Amul,"Beverages and beverages preparations, Beverages, en:yogurt-drinks",4,e,http://world-en.openfoodfacts.org/product/8901262202046/amul-lassi
8901260000000,Amul Lassi 200ml,Amul,"Beverages, Dairies, Fermented foods, Fermented milk products, Desserts, Dairy desserts, Dairy drinks, Fermented dairy desserts, Fermented drinks, Yogurts, Fermented milk drinks, Drinkable-yogurts, Lassi, en:yogurt-drinks",4,e,http://world-en.openfoodfacts.org/product/8901262200189/amul-lassi-200ml
8901260000000,Amul Lassi 250 ml,Amul,"Beverages, Dairies, Fermented foods, Fermented milk products, Desserts, Dairy desserts, Dairy drinks, Fermented dairy desserts, Fermented drinks, Yogurts, Fermented milk drinks, Drinkable-yogurts, Dairy based drink, en:yogurt-drinks",4,e,http://world-en.openfoodfacts.org/product/8901262151696/amul-lassi-250-ml
8901260000000,Amul Masti Spiced Buttermilk,Amul,"Beverages, Dairies, Fermented foods, Fermented milk products, Milks, Buttermilks",4,c,http://world-en.openfoodfacts.org/product/8901262200196/amul-masti-spiced-buttermilk
4901960000000,Amul Pasteurised Butter,Amul,"Dairies,Butters",4,unknown,http://world-en.openfoodfacts.org/product/4901960000016/amul-pasteurised-butter
8901260000000,Amul Pizza Margherita,Amul,"Meals,Pizzas pies and quiches,Pizzas,Vegetarian pizzas,Cheese pizzas",4,d,http://world-en.openfoodfacts.org/product/8901262220965/amul-pizza-margherita
8901260000000,Amul Pro Chocolate 500g pp,Amul,"Beverages, Sweetened beverages",4,e,http://world-en.openfoodfacts.org/product/8901262130325/amul-pro-chocolate-500g-pp
8901260000000,Amul Spiced Buttermilk,Amul,"Dairies,Fermented foods,Fermented milk products,Milks,Buttermilks",4,unknown,http://world-en.openfoodfacts.org/product/8901262201001/amul-spiced-buttermilk
8901260000000,Amul Sugar free chocolate,Amul,"Snacks, Sweet snacks, Cocoa and its products, Chocolates, Sugar free chocolate, en:chocolate-candies",4,d,http://world-en.openfoodfacts.org/product/8901262071048/amul-sugar-free-chocolate
8901260000000,Amul Vanilla Gold,Amul,"Desserts, Frozen foods, Frozen desserts, Ice creams and sorbets, Ice creams, en:ice-cream-tubs",4,d,http://world-en.openfoodfacts.org/product/8901262174244/amul-vanilla-gold
8901260000000,Amul kool elaichi 180ml,Amul,"Beverages, Dairies, Dairy drinks",4,e,http://world-en.openfoodfacts.org/product/8901262152228/amul-kool-elaichi-180ml
8901260000000,Black Currant Tri Cone,Amul,"Black currant ice cream cone, en:ice-creams",4,d,http://world-en.openfoodfacts.org/product/8901262178365/black-currant-tri-cone-amul
8901260000000,Butter Nankhatai,Amul,"Snacks, Sweet snacks, Biscuits and cakes, Biscuits",4,e,http://world-en.openfoodfacts.org/product/8901262221382/butter-nankhatai-amul
8901260000000,Butterscotch Bliss,Amul,"Desserts,Frozen foods,Frozen desserts,Ice creams and sorbets,Ice creams,Ice cream in a box",4,d,http://world-en.openfoodfacts.org/product/8901262173223/butterscotch-bliss-amul
41102177191,Cassatta,Amul,"Desserts, Frozen foods, Frozen desserts, Ice creams and sorbets, Ice creams",4,d,http://world-en.openfoodfacts.org/product/0041102177191/cassatta-amul
8901260000000,Cheese Spread,Amul,Cheese spreads,4,unknown,http://world-en.openfoodfacts.org/product/8901262060011/cheese-spread-amul
8901260000000,Cheese slices,Amul,"Dairies,Fermented foods,Fermented milk products,Cheeses,Processed cheese,Processed cheese in slices",4,e,http://world-en.openfoodfacts.org/product/8901262020015/cheese-slices-amul
8901260000000,Choco Almond N' Kesar Badam Double Sundae,Amul,"Desserts, Frozen foods, Frozen desserts, Ice creams and sorbets, Ice creams, Ice cream tubs",4,d,http://world-en.openfoodfacts.org/product/8901262178068/choco-almond-n-kesar-badam-double-sundae-amul
8901260000000,Chocolate Cookies,Amul,"Snacks, Sweet snacks, Biscuits and cakes, Biscuits, Chocolate biscuits",4,e,http://world-en.openfoodfacts.org/product/8901262220552/chocolate-cookies-amul
8901260000000,Chocolate Crackle Ice cream,Amul,"Desserts,Frozen foods,Frozen desserts,Ice creams and sorbets,Ice creams,Ice cream in a box",4,d,http://world-en.openfoodfacts.org/product/8901262300117/chocolate-crackle-ice-cream-amul
8901260000000,Chocolate Magic Sundae,Amul,"Desserts,Frozen foods,Frozen desserts,Ice creams and sorbets",4,e,http://world-en.openfoodfacts.org/product/8901262178075/chocolate-magic-sundae-amul
8901260000000,Chocominis,Amul,Amul Dark Chocolate,4,e,http://world-en.openfoodfacts.org/product/8901262070546/chocominis-amul
8901260000000,Chocozoo,Amul,sweet snacks,4,e,http://world-en.openfoodfacts.org/product/8901262071581/chocozoo-amul
8901260000000,Cookie Sub,Amul,Ice cream sandwiches,4,d,http://world-en.openfoodfacts.org/product/8901262178440/cookie-sub-amul
8901260000000,Dark Chocolate,Amul,"Snacks,Sweet snacks,Cocoa and its products,Bars,Chocolates,Dark chocolates",4,e,http://world-en.openfoodfacts.org/product/8901262070676/dark-chocolate-amul
8901260000000,Double Chocolate Milk Shake,Amul,Milk-based drinks,4,e,http://world-en.openfoodfacts.org/product/8901262152143/double-chocolate-milk-shake-amul
8901260000000,Epic Choco Almond with Beligian Chocolate,Amul,Chocolate ice cream bars,4,e,http://world-en.openfoodfacts.org/product/8901262178198/epic-choco-almond-with-beligian-chocolate-amul
8901260000000,FRUIT N' NUT Dark Chocolate,Amul,"Snacks, Sweet snacks, Cocoa and its products, Confectioneries, Chocolates, Dark chocolates, Dark chocolate bar with dried fruits, Composite chocolate",4,e,http://world-en.openfoodfacts.org/product/8901262070539/fruit-n-nut-dark-chocolate-amul
8901260000000,Garlic & Herbs Buttery Spread,Amul,"Dairies, Fats, Spreads, Spreadable fats, Animal fats, Milkfat, Dairy-spread, Butters, Butter fat",4,e,http://world-en.openfoodfacts.org/product/8901262010344/garlic-herbs-buttery-spread-amul
8901260000000,Ice Cream Sandwich Vanilla,Amul,"Desserts,Frozen foods,Frozen desserts,Ice creams and sorbets,Ice creams,Ice cream sandwiches",4,e,http://world-en.openfoodfacts.org/product/8901262178259/ice-cream-sandwich-vanilla-amul
8901260000000,Ice Malai,Amul,"Desserts,Ice cream in individual cup,Frozen desserts",4,c,http://world-en.openfoodfacts.org/product/8901262301695/ice-malai-amul
8901260000000,Lassi Pineapple,Amul,"Dairy drinks,Lassi",4,e,http://world-en.openfoodfacts.org/product/8901262152631/lassi-pineapple-amul
8901260000000,Lite Bread Spread,Amul,"Plant-based foods and beverages, Plant-based foods, Fats, Spreads, Plant-based spreads, Salted spreads, Spreadable fats, Vegetable fats, Margarines",4,d,http://world-en.openfoodfacts.org/product/8901262140065/lite-bread-spread-amul
8901260000000,Mawa Malai Kulfi,Amul,"Desserts, Frozen foods, Frozen desserts, Ice creams and sorbets, Ice creams, Ice cream bars",4,d,http://world-en.openfoodfacts.org/product/8901262176477/mawa-malai-kulfi-amul
8901260000000,Milk Shake Double Chocolate,Amul,"Beverages, Dairies, Dairy drinks, Flavoured milks, Chocolate milks",4,e,http://world-en.openfoodfacts.org/product/8901262152136/milk-shake-double-chocolate-amul
8901260000000,Peanut Butter,Amul,"Plant-based foods and beverages,Plant-based foods,Legumes and their products,Spreads,Plant-based spreads,Oilseed purees,Legume butters,Peanut butters",4,c,http://world-en.openfoodfacts.org/product/8901262010511/peanut-butter-amul
8901260000000,Pista malai kulfi,Amul,"Desserts, Frozen foods, Frozen desserts, Ice creams and sorbets, Ice creams, Icecream",4,e,http://world-en.openfoodfacts.org/product/8901262176446/pista-malai-kulfi-amul
8901260000000,Protein Buttermilk,Amul,"Beverages, Dairies, Fermented foods, Desserts, Fermented milk products, Dairy desserts, Dairy drinks, Fermented dairy desserts, Fermented drinks, Fermented milk drinks, Yogurts, Drinkable yogurts",4,b,http://world-en.openfoodfacts.org/product/8901262152952/protein-buttermilk-amul
8901260000000,Protein Kulfi,Amul,Kulfi,4,a,http://world-en.openfoodfacts.org/product/8901262301862/protein-kulfi-amul
8901260000000,Protein Lassi - Mango flavour,Amul,"Beverages, Dairies, Fermented foods, Desserts, Fermented milk products, Dairy desserts, Dairy drinks, Fermented dairy desserts, Fermented drinks, Fermented milk drinks, Yogurts, Drinkable yogurts",4,c,http://world-en.openfoodfacts.org/product/8901262152945/protein-lassi-mango-flavour-amul
8906090000000,Protein Water,Amul,beverages,4,b,http://world-en.openfoodfacts.org/product/8906090641067/protein-water-amul
8901260000000,Punjabi Kulfi Mawa Elaichi,Amul,"Desserts,Frozen foods,Frozen desserts,Ice creams and sorbets,Ice creams,Ice cream bars",4,unknown,http://world-en.openfoodfacts.org/product/8901262176552/punjabi-kulfi-mawa-elaichi-amul
8901260000000,Sugar free dark chocolate,Amul,"Snacks,Sweet snacks,Cocoa and its products,Chocolates,Chocolates with sweeteners,Dark chocolates,Dark chocolates with sweeteners,Dark chocolate bar without sugar and with artificial sweeteners",4,d,http://world-en.openfoodfacts.org/product/8901262070324/sugar-free-dark-chocolate-amul
8901260000000,Sundae Gudbud,Amul,"Desserts,Frozen foods,Frozen desserts,Ice creams and sorbets,Ice creams",4,d,http://world-en.openfoodfacts.org/product/8901262174404/sundae-gudbud-amul
8901260000000,Super Fruit,Amul,White chocolate bar with dried fruits,4,e,http://world-en.openfoodfacts.org/product/8901262071109/super-fruit-amul
8901260000000,Twilight Tryst Single Origin Dark Chocolate,Amul,"Snacks,Sweet snacks,Cocoa and its products,Chocolates,Dark chocolates,Dark chocolate bar",4,e,http://world-en.openfoodfacts.org/product/8901262071703/twilight-tryst-single-origin-dark-chocolate-amul
8901260000000,Vanilla ice cream,Amul,Ice cream in a box,4,d,http://world-en.openfoodfacts.org/product/8901262173490/vanilla-ice-cream-amul
8901060000000,,Britannia,en:biscuits,4,d,http://world-en.openfoodfacts.org/product/8901063014411/britannia
8901060000000,,Britannia,en:biscuits,4,c,http://world-en.openfoodfacts.org/product/8901063142664/britannia
8901060000000,100% Whole Wheat Sandwich Bread,Britannia,"Plant-based foods and beverages, Plant-based foods, Cereals and potatoes, Breads, Sliced breads, Wholemeal breads, Wholemeal sliced breads",4,unknown,http://world-en.openfoodfacts.org/product/8901063342934/100-whole-wheat-sandwich-bread-britannia
8901060000000,50 50,Britannia,"Snacks, Sweet snacks, Biscuits and cakes, Biscuits",4,e,http://world-en.openfoodfacts.org/product/8901063016880/50-50-britannia
8901060000000,50 50 Gol Maal,Britannia,"Snacks,Sweet snacks,Confectioneries,Bars,Biscuits and cakes,Biscuits",4,e,http://world-en.openfoodfacts.org/product/8901063017702/50-50-gol-maal-britannia
8901060000000,50 50 Golmaal,Britannia,"Snacks, Sweet snacks, Biscuits and cakes, Biscuits",4,e,http://world-en.openfoodfacts.org/product/8901063017719/50-50-golmaal-britannia
8901060000000,50-50,Britannia,Biscuits,4,unknown,http://world-en.openfoodfacts.org/product/8901063016873/50-50-britannia
8901060000000,50-50,Britannia,,4,unknown,http://world-en.openfoodfacts.org/product/8901063017252/50-50-britannia
8901060000000,50-50 Maska Chaska,Britannia,"Snacks,Sweet snacks,Biscuits and cakes,Biscuits",4,e,http://world-en.openfoodfacts.org/product/8901063017481/50-50-maska-chaska-britannia
8901060000000,50-50 sweet and salt,Britannia,,4,unknown,http://world-en.openfoodfacts.org/product/8901063016606/50-50-sweet-and-salt-britannia
8901060000000,5050 Golmaal,Britannia,"Snacks,Sweet snacks,Biscuits and cakes,Biscuits and crackers,Biscuits",4,e,http://world-en.openfoodfacts.org/product/8901063017795/5050-golmaal-britannia
8901060000000,B. waffy choco,Britannia,,4,unknown,http://world-en.openfoodfacts.org/product/8901063032675/b-waffy-choco-britannia
8901060000000,BOURBON,Britannia,"Snacks, Sweet snacks, Biscuits and cakes, Biscuits, en:chocolate-biscuits",4,e,http://world-en.openfoodfacts.org/product/8901063139374/bourbon-britannia
8901060000000,BRITANN Good day 600 g,Britannia,"Snacks,Breakfasts,Sweet snacks,Biscuits and cakes,Biscuits,Dry biscuits,Breakfast biscuit",4,e,http://world-en.openfoodfacts.org/product/8901063092501/britann-good-day-600-g-britannia
8901060000000,BRITANNIA Cake Gobbles Fruity Fun,Britannia,"Snacks, Sweet snacks, Biscuits and cakes, Cakes",4,e,http://world-en.openfoodfacts.org/product/8901063363977/britannia-cake-gobbles-fruity-fun
8901060000000,"BRITANNIA nutri SUGAR, FREE",Britannia,"Biscuits,Biscuits/Cookies (Shelf Stable),sugar free biscuit",4,d,http://world-en.openfoodfacts.org/product/8901063026162/britannia-nutri-sugar-free
8901060000000,Biscafe Biscuit 🍪,Britannia,da:crackers,4,e,http://world-en.openfoodfacts.org/product/8901063365018/biscafe-biscuit-%F0%9F%8D%AA-britannia
8901060000000,Bourbon,Britannia,"Snacks, Sweet snacks, Biscuits and cakes, Biscuits, Chocolate biscuits",4,e,http://world-en.openfoodfacts.org/product/8901063139206/bourbon-britannia
8901060000000,Brit 100% veg cake,Britannia,"Snacks,Sweet snacks,Biscuits and cakes,Cakes",4,e,http://world-en.openfoodfacts.org/product/8901063365087/brit-100-veg-cake-britannia
8901060000000,Brit 50-50 maska chaska 40g (20),Britannia,"Snacks, Sweet snacks, Biscuits and cakes, Biscuits",4,d,http://world-en.openfoodfacts.org/product/8901063017627/brit-50-50-maska-chaska-40g-20-britannia
8901060000000,Brit bourbon 150g (sys),Britannia,en:biscuits,4,e,http://world-en.openfoodfacts.org/product/8901063139213/brit-bourbon-150g-sys-britannia
8901060000000,Britannia 5050 Potazos 71.5g,Britannia,"Snacks, Sweet snacks, Biscuits and cakes, Biscuits",4,unknown,http://world-en.openfoodfacts.org/product/8901063017559/britannia-5050-potazos-71-5g
8901060000000,Britannia 5050(72g),Britannia,,4,unknown,http://world-en.openfoodfacts.org/product/8901063016781/britannia-5050-72g
8901060000000,Britannia Cake Gobbles 35g,Britannia,"Snacks,Sweet snacks,Biscuits and cakes,Biscuits,Cakes",4,e,http://world-en.openfoodfacts.org/product/8901063365384/britannia-cake-gobbles-35g
8901060000000,Britannia Good day Chocolate Cookies 400g,Britannia,Chocolate biscuity bars,4,e,http://world-en.openfoodfacts.org/product/8901063004139/britannia-good-day-chocolate-cookies-400g
8901060000000,Britannia Marie Gold,Britannia,"Snacks,Sweet snacks,Biscuits and cakes,Biscuits,Dry biscuits,Plain biscuit",4,d,http://world-en.openfoodfacts.org/product/8901063162242/britannia-marie-gold
8901060000000,Britannia Marie Gold,Britannia,Biscuits,4,e,http://world-en.openfoodfacts.org/product/8901063162648/britannia-marie-gold
8901060000000,Britannia Nutri Choice Oats,Britannia,Biscuits,4,d,http://world-en.openfoodfacts.org/product/8901063142114/britannia-nutri-choice-oats
8901060000000,Britannia Pav,Britannia,"Plant-based foods and beverages,Plant-based foods,Cereals and potatoes,Breads",4,d,http://world-en.openfoodfacts.org/product/8901063338494/britannia-pav
8901060000000,Britannia Treat Strawberry flavoured Waffers,Britannia,,4,unknown,http://world-en.openfoodfacts.org/product/8901063032699/britannia-treat-strawberry-flavoured-waffers
8901060000000,Britannia Winkin cow thick lassi 180ml,Britannia,"Dairies,beverages",4,e,http://world-en.openfoodfacts.org/product/8901063146297/britannia-winkin-cow-thick-lassi-180ml
8901060000000,Britannia bourbon 100g,Britannia,"Snacks, en:biscuits",4,e,http://world-en.openfoodfacts.org/product/8901063139336/britannia-bourbon-100g
8901060000000,Britannia cake fruity fun,Britannia,"Snacks, Sweet snacks, Biscuits and cakes, Cakes, en:biscuits",4,d,http://world-en.openfoodfacts.org/product/8901063363779/britannia-cake-fruity-fun
8901060000000,Britannia nutri choice,Britannia,,4,unknown,http://world-en.openfoodfacts.org/product/8901063028708/britannia-nutri-choice
8901060000000,Britannia toastea,Britannia,Bakery products,4,d,http://world-en.openfoodfacts.org/product/8901063325463/britannia-toastea
8901060000000,Britannia treat Croissant Mixed Fruit,Britannia,Snacks,4,e,http://world-en.openfoodfacts.org/product/8901063032484/britannia-treat-croissant-mixed-fruit
8901060000000,Brittania Maska chaska,Britannia,"Snacks, Sweet snacks, Biscuits and cakes, Biscuits, Biscuit (cookie) snack w chocolate filling",4,d,http://world-en.openfoodfacts.org/product/8901063017221/brittania-maska-chaska-britannia
8901060000000,Brown bread,Britannia,"Plant-based foods and beverages,Plant-based foods,Cereals and potatoes,Breads,Wholemeal breads",4,c,http://world-en.openfoodfacts.org/product/8901063338685/brown-bread-britannia
8901060000000,CAKE 100% VEG Gobbles fruity fun,Britannia,"Snacks, Sweet snacks, Biscuits and cakes, Cakes, Soft fruit cakes",4,e,http://world-en.openfoodfacts.org/product/8901063363748/cake-100-veg-gobbles-fruity-fun-britannia
8901060000000,Gobbles Orange Bites cake,Britannia,"Snacks,Sweet snacks,Cakes",4,e,http://world-en.openfoodfacts.org/product/8901063363786/gobbles-orange-bites-cake-britannia
8901060000000,Good Day - Cashew Cookies,Britannia,"Snacks, Sweet snacks, Biscuits and cakes, Biscuits, Cooking helpers, Pastry helpers, Variety packs, Baking Mixes, Biscuits or cookies variety packs, Dessert mixes, Biscuit mixes, Biscuits/Cookies (Shelf Stable)",4,unknown,http://world-en.openfoodfacts.org/product/8901063093522/good-day-cashew-cookies-britannia
8901060000000,Good Day Butter Cookies,Britannia,"Snacks, Sweet snacks, Biscuits and cakes, Biscuits",4,e,http://world-en.openfoodfacts.org/product/8901063092617/good-day-butter-cookies-britannia
8901060000000,Good Day Butter Cookies (25),Britannia,"Snacks, Sweet snacks, Biscuits and cakes, Biscuits",4,e,http://world-en.openfoodfacts.org/product/8901063092686/good-day-butter-cookies-25-britannia
8901060000000,Good Day Cashew Cookies,Britannia,"Snacks, Sweet snacks, Biscuits and cakes, Biscuits",4,e,http://world-en.openfoodfacts.org/product/8901063093287/good-day-cashew-cookies-britannia
8901060000000,Good Day Cashew Cookies Medium Pack 600g,Britannia,"Snacks,Sweet snacks,Biscuits and cakes,Biscuits",4,e,http://world-en.openfoodfacts.org/product/8901063093355/good-day-cashew-cookies-medium-pack-600g-britannia
8901060000000,GoodDay Choco Chip,Britannia,"Snacks, Sweet snacks, Biscuits and cakes, Biscuits, Chocolate biscuits",4,unknown,http://world-en.openfoodfacts.org/product/8901063004122/goodday-choco-chip-britannia
8901060000000,Jim Jam,Britannia,"Flavoured sandwich Biscuits, en:biscuits",4,e,http://world-en.openfoodfacts.org/product/8901063029217/jim-jam-britannia
8901060000000,Jimjam,Britannia,"Snacks, Snacks sucrés, Biscuits et gâteaux, Biscuits",4,e,http://world-en.openfoodfacts.org/product/8901063029279/jimjam-britannia
8901060000000,Jimjam 460g,Britannia,"Snacks, Sweet snacks, Biscuits and cakes, Biscuits",4,e,http://world-en.openfoodfacts.org/product/8901063029286/jimjam-460g-britannia
8901060000000,Jimjam 57g (57),Britannia,Biscuits,4,unknown,http://world-en.openfoodfacts.org/product/8901063029255/jimjam-57g-57-britannia
8901060000000,Jimjam Pops,Britannia,"Snacks, Sweet snacks, Biscuits and cakes, Biscuits, Biscuits/Cookies (Shelf Stable), Cream biscuit",4,e,http://world-en.openfoodfacts.org/product/8901063029309/jimjam-pops-britannia
8901060000000,Jimjam pops,Britannia,"Snacks, Sweet snacks, Biscuits and cakes, Biscuits",4,e,http://world-en.openfoodfacts.org/product/8901063029316/jimjam-pops-britannia
8901060000000,Little Hearts Classic,Britannia,"Snacks, Sweet snacks, Biscuits and cakes, Biscuits, Sugar coated biscuit",4,e,http://world-en.openfoodfacts.org/product/8901063019027/little-hearts-classic-britannia
8901060000000,Marie Gold,Britannia,"Snacks,Sweet snacks,Biscuits and cakes,Biscuits and crackers,Biscuits,Snack biscuit with fruits filling",4,e,http://world-en.openfoodfacts.org/product/8901063023901/marie-gold-britannia
8901060000000,Marie Gold,Britannia,"Snacks, Sweet snacks, Biscuits and cakes, Biscuits",4,e,http://world-en.openfoodfacts.org/product/8901063162600/marie-gold-britannia
8901060000000,Marie gold,Britannia,"Snacks, Sweet snacks, Biscuits and cakes, Biscuits",4,e,http://world-en.openfoodfacts.org/product/8901063162426/marie-gold-britannia
8901060000000,Marie gold 5*117g (4),Britannia,en:biscuits,4,e,http://world-en.openfoodfacts.org/product/8901063162525/marie-gold-5-117g-4-britannia
8901060000000,Milk Bikis,Britannia,"Snacks, Sweet snacks, Biscuits and cakes, Biscuits",4,e,http://world-en.openfoodfacts.org/product/8901063012530/milk-bikis-britannia
8901060000000,Milk Bikis,Britannia,"Snacks, Sweet snacks, Biscuits and cakes, Biscuits",4,d,http://world-en.openfoodfacts.org/product/8901063012608/milk-bikis-britannia
8901060000000,Milk Bikis,Britannia,"Snacks,Sweet snacks,Biscuits and cakes,Biscuits",4,e,http://world-en.openfoodfacts.org/product/8901063012622/milk-bikis-britannia
8901060000000,Milk Bikis,Britannia,"Snacks,Sweet snacks,Biscuits and cakes,Biscuits and crackers,Biscuits",4,e,http://world-en.openfoodfacts.org/product/8901063012660/milk-bikis-britannia
8901060000000,Milk bikis,Britannia,"Snacks, Sweet snacks, Biscuits and cakes, Biscuits",4,d,http://world-en.openfoodfacts.org/product/8901063012547/milk-bikis-britannia
8901060000000,Multi Grain Bread,Britannia,"Plant-based foods and beverages, Plant-based foods, Cereals and potatoes, Breads, Wholemeal breads",4,unknown,http://world-en.openfoodfacts.org/product/8901063338623/multi-grain-bread-britannia
8901060000000,Multi Grain Bread,Britannia,"Plant-based foods and beverages,Plant-based foods,Cereals and potatoes,Breads,Multigrain sliced breads",4,c,http://world-en.openfoodfacts.org/product/8901063343276/multi-grain-bread-britannia
8901060000000,Nutri Choice Digestive,Britannia,"Snacks, Sweet snacks, Biscuits and cakes, Biscuits",4,unknown,http://world-en.openfoodfacts.org/product/8901063142466/nutri-choice-digestive-britannia
8901060000000,Nutri Choice Sugar Free Crackers,Britannia,"snacks, salty-snacks, appetizers, da:crackers",4,d,http://world-en.openfoodfacts.org/product/8901063026278/nutri-choice-sugar-free-crackers-britannia
3948060000000,Nutri choise essentials,Britannia,en:biscuits,4,unknown,http://world-en.openfoodfacts.org/product/3948063154025/nutri-choise-essentials-britannia
8901060000000,Sugar Free Cracker Nature spice Jeera & Ajwain,Britannia,"wheat-crackers, biscuits",4,d,http://world-en.openfoodfacts.org/product/8901063026209/sugar-free-cracker-nature-spice-jeera-ajwain-britannia
8901060000000,The Laughing Cow Cheese Slices,Britannia,"Dairies,Fermented foods,Fermented milk products,Cheeses",4,e,http://world-en.openfoodfacts.org/product/8901063410282/the-laughing-cow-cheese-slices-britannia
8901060000000,Tiger Krunch ChocoChips,Britannia,"Snacks,Sweet snacks,Biscuits and cakes,Biscuits,Chocolate biscuits",4,unknown,http://world-en.openfoodfacts.org/product/8901063155459/tiger-krunch-chocochips-britannia
8901060000000,Toastea Rusk,Britannia,Rusks,4,d,http://world-en.openfoodfacts.org/product/8901063325784/toastea-rusk-britannia
8901060000000,Toastea premium rusk,Britannia,"Plant-based foods and beverages,Plant-based foods,Cereals and potatoes,Breads,Premium Bake Rusk,Toasted bread",4,d,http://world-en.openfoodfacts.org/product/8901063325609/toastea-premium-rusk-britannia
8901060000000,Treat Vanilla Creme,Britannia,"Snacks, Sweet snacks, Biscuits and cakes, Biscuits, Cream sandwich biscuits",4,e,http://world-en.openfoodfacts.org/product/8901063033399/treat-vanilla-creme-britannia
8901060000000,Vitarich Sandwich Premium White Bread,Britannia,"Plant-based foods and beverages, Plant-based foods, Cereals and potatoes, Breads, Sliced breads",4,c,http://world-en.openfoodfacts.org/product/8901063342026/vitarich-sandwich-premium-white-bread-britannia
8901060000000,britannia treat croissant vanilla creme roll,Britannia,"Snacks, Sweet snacks, Viennoiseries",4,unknown,http://world-en.openfoodfacts.org/product/8901063031937/britannia-treat-croissant-vanilla-creme-roll
8901060000000,good day cashew cookies,Britannia,"Snacks, Sweet snacks, Biscuits and cakes, Biscuits",4,unknown,http://world-en.openfoodfacts.org/product/8901063093409/good-day-cashew-cookies-britannia
8901060000000,nutri choice,Britannia,"Snacks,Sweet snacks,Biscuits and cakes,Biscuits and crackers,Biscuits",4,unknown,http://world-en.openfoodfacts.org/product/8901063142336/nutri-choice-britannia
